<?xml version="1.0" encoding="UTF-8"?>
<!-- edited with XMLSpy v2018 (x64) (http://www.altova.com) by Finnish Customs (Finnish Customs) -->
<xs:schema xmlns:xs="http://www.w3.org/2001/XMLSchema" elementFormDefault="qualified" attributeFormDefault="unqualified">
	<xs:element name="RulesConditions">
		<xs:annotation>
			<xs:documentation>Comment describing your root element</xs:documentation>
		</xs:annotation>
		<xs:complexType>
			<xs:complexContent>
				<xs:extension base="RulesConditionsType"/>
			</xs:complexContent>
		</xs:complexType>
	</xs:element>
	<xs:complexType name="RulesConditionsType">
		<xs:sequence>
			<xs:element name="RuleCondition" maxOccurs="unbounded">
				<xs:complexType>
					<xs:sequence>
						<xs:element name="ID"/>
						<xs:element name="DescriptionLine" maxOccurs="unbounded">
							<xs:complexType>
								<xs:simpleContent>
									<xs:extension base="xs:string">
										<xs:attribute name="lang" default="en"/>
									</xs:extension>
								</xs:simpleContent>
							</xs:complexType>
						</xs:element>
					</xs:sequence>
				</xs:complexType>
			</xs:element>
		</xs:sequence>
	</xs:complexType>
</xs:schema>
