<?xml version="1.0" encoding="UTF-8"?>
<RulesConditions xmlns:xsi="http://www.w3.org/2001/XMLSchema-instance" xsi:noNamespaceSchemaLocation="RulesConditions.xsd">
	<RuleCondition>
		<ID>NC0601</ID>
		<DescriptionLine lang="en">IF 'Availabe for clearance' = '1'</DescriptionLine>
		<DescriptionLine lang="en">  THEN This data group / data element = 'R'</DescriptionLine>
		<DescriptionLine lang="en">  ELSE it cannot be used</DescriptionLine>
	</RuleCondition>
	<RuleCondition>
		<ID>NC0602</ID>
		<DescriptionLine lang="en">IF 'Availabe for clearance' = '1'</DescriptionLine>
		<DescriptionLine lang="en">  THEN This data group / data element = 'O'</DescriptionLine>
		<DescriptionLine lang="en">  ELSE it cannot be used</DescriptionLine>
	</RuleCondition>
	<RuleCondition>
		<ID>NC0603</ID>
		<DescriptionLine lang="en">IF Previous document is an Arex MRN</DescriptionLine>
		<DescriptionLine lang="en">  THEN This data element = 'R'</DescriptionLine>
		<DescriptionLine lang="en">  ELSE it cannot be used</DescriptionLine>
	</RuleCondition>
</RulesConditions>
